id,src,tgt
573,mehmet ali koçyiğitten sonra kardeşi fatmada yaşamını yitirdi son haber,mehmet ali koçyiğitten sonra kardeşi fatma da yaşamını yitirdi son haber
574,"çetin , karzaininde hikmet abisi son","çetin , karzainin de hikmet abisi son"
575,şaron ölümle yaşam arasın da !,şaron ölümle yaşam arasında !
576,sağlık bakanı recep akdağ evler de öncelikli olarak alınması gereken önlemleri açıkladı .,sağlık bakanı recep akdağ evlerde öncelikli olarak alınması gereken önlemleri açıkladı .
577,"lindsay , tiraj yarışın da !","lindsay , tiraj yarışında !"
578,"kuş gribinin türkiye de can aldığının kesin çeşmesi , dünya kamuoyunun dikkatini türkiyeye çevirdi .","kuş gribinin türkiyede can aldığının kesin çeşmesi , dünya kamuoyunun dikkatini türkiyeye çevirdi ."
579,galatasaray üniversitesi öğrencisi be gümü öldüren maganda kur tununun arkasın da kıskanç bir aşık çıktı son,galatasaray üniversitesi öğrencisi be gümü öldüren maganda kur tununun arkasında kıskanç bir aşık çıktı son
580,durgun geçen ara transfer dönemin de vestel manisaspor bugün zelenkayı renklerine bağladı son haber,durgun geçen ara transfer döneminde vestel manisaspor bugün zelenkayı renklerine bağladı son haber
581,ronaldinhonun reklam filmin de çekilen bu görüntüleri dünyayı şok etti .,ronaldinhonun reklam filminde çekilen bu görüntüleri dünyayı şok etti .
582,kurbanlık fiyatları geçen seneyle aynı seviye de,kurbanlık fiyatları geçen seneyle aynı seviyede
583,irakta seçim sonuçları 4 gün için de açıklanıyor,irakta seçim sonuçları 4 gün içinde açıklanıyor
584,rektör aşkın görevinin başın da ...,rektör aşkın görevinin başında ...
585,van da 200 kanatlı hayvan itlaf edildi,vanda 200 kanatlı hayvan itlaf edildi
586,erzurum da ülkücüler birbirine girdi,erzurumda ülkücüler birbirine girdi
587,fener de kilolular ve küfür edenler yandı !,fenerde kilolular ve küfür edenler yandı !
588,alman ligin de yabancı oyuncu sınırı kalktı,alman liginde yabancı oyuncu sınırı kalktı
589,yat limakın da patlama !,yat limakında patlama !
590,antalya yat limakın da bir patlama meydana geldi .,antalya yat limakında bir patlama meydana geldi .
591,i̇şkencede yapılmış !,i̇şkence de yapılmış !
592,"acımasız katil , 16 yaşında ki kıza bıçakla işkencede yapmış ...","acımasız katil , 16 yaşındaki kıza bıçakla işkence de yapmış ..."
593,burnuna estetik yaptırmak isteyen i̇hracat müdürü genç kadının kalbi ameliyat masasın da durdu,burnuna estetik yaptırmak isteyen i̇hracat müdürü genç kadının kalbi ameliyat masasında durdu
594,bonservisi elin de olan i̇lhana teklif yağıyor son haber,bonservisi elinde olan i̇lhana teklif yağıyor son haber
595,gelde inan .,gel de inan .
596,halk arasında ki ilginç inanışlar geçerliliğini günümüz dede sürdürüyor .,halk arasındaki ilginç inanışlar geçerliliğini günümüzde de sürdürüyor .
597,gelenlerde olabilir gidenlerde !,gelenler de olabilir gidenler de !
598,bankacılık hala yüksek risk ortamın da,bankacılık hala yüksek risk ortamında
599,"turizmde ki artış , cari açığı daraltacak","turizmdeki artış , cari açığı daraltacak"
600,bat sigaralarıda zamlandı !,bat sigaraları da zamlandı !
601,necef de sadr güçleri büyük direniş gösteriyor,necefte sadr güçleri büyük direniş gösteriyor
602,gol yesekde yola devam,gol yesek de yola devam
603,erken biten rock coke de para iadesi ...,erken biten rock cokede para iadesi ...
604,del bosque kadro da revizyona gidiyor ...,del bosque kadroda revizyona gidiyor ...
605,yavuz adın da bir oğlum yok,yavuz adında bir oğlum yok
606,nadir elmaslarla kaplı dünyanın en pahalı bikinisi sokak da tanıtıldı,nadir elmaslarla kaplı dünyanın en pahalı bikinisi sokakta tanıtıldı
607,arkadaşlarıyla birlik de eğlenen güzel şarkıcının yine durgun olduğu gözlerden kaçmadı .,arkadaşlarıyla birlikte eğlenen güzel şarkıcının yine durgun olduğu gözlerden kaçmadı .
608,sahne de program yapan ...,sahnede program yapan ...
609,"erdoğan , alınan kararın bundan önce ki açıklamalarla çelişmediğinide savundu .","erdoğan , alınan kararın bundan önceki açıklamalarla çelişmediğini de savundu ."
610,bayram da çalışanlar uzun bir tatil yapacak .,bayramda çalışanlar uzun bir tatil yapacak .
611,"bisikletleri ile türkiyeye gelen iki alman kadın , 20 gün önce esrarengiz şekil de ortadan kaybol","bisikletleri ile türkiyeye gelen iki alman kadın , 20 gün önce esrarengiz şekilde ortadan kaybol"
612,"yasak , kürtaj yasağına giden yol da ilk adım olarak yorumlanıyor ...","yasak , kürtaj yasağına giden yolda ilk adım olarak yorumlanıyor ..."
613,"ab , türkçe alfabe de o , o , o harflerinin bulunmamasını eleştirilmişti .","ab , türkçe alfabede o , o , o harflerinin bulunmamasını eleştirilmişti ."
614,hollândam da yaşayan türkerde türkçe harfler için başvuru da bulundu !,hollândamda yaşayan türker de türkçe harfler için başvuruda bulundu !
615,kadro da i̇ngiltere maçından farklı olarak sakatlığı süren sergenin yerine tümer var ...,kadroda i̇ngiltere maçından farklı olarak sakatlığı süren sergenin yerine tümer var ...
616,kıbrıs da rum tezinin etkisin de kalıyor,kıbrısta rum tezinin etkisinde kalıyor
617,tunceli de bir garip teşhir,tuncelide bir garip teşhir
618,"bingöl de çatışma , 5 pkkyı öldürüldü son","bingölde çatışma , 5 pkkyı öldürüldü son"
619,tenetlerimi kullandım deyince iki ülke arasın da kriz çıktı son,tenetlerimi kullandım deyince iki ülke arasında kriz çıktı son
620,yurdum i̇nsa anın da bu haf ta,yurdum i̇nsa anında bu haf ta
621,konfederasyon kupasın da dünya yeni bir zıplayan jimmy ile ta,konfederasyon kupasında dünya yeni bir zıplayan jimmy ile ta
622,yarın önünde ki şov foto galeri,yarın önündeki şov foto galeri
623,"trabzonspor , şampiyonlar ligi ikinci ön elemesin de dinamo minsk ve anorthosis maçının galibiyle oynayacak ...","trabzonspor , şampiyonlar ligi ikinci ön elemesinde dinamo minsk ve anorthosis maçının galibiyle oynayacak ..."
624,borsa haftayı 27 bin puanın üzerin de tamamladı,borsa haftayı 27 bin puanın üzerinde tamamladı
625,benzine yirmi gün de üçüncü zam geldi,benzine yirmi günde üçüncü zam geldi
626,fuhuş da yakalananlara i̇nternetten teşhir,fuhuşta yakalananlara i̇nternetten teşhir
627,festivale seyyar tuvalet için de gitmek istediler ama ...,festivale seyyar tuvalet içinde gitmek istediler ama ...
628,hangi ülke de en çok hangi soyadları kullanılıyor ?,hangi ülkede en çok hangi soyadları kullanılıyor ?
629,akp iktidarın da ilk ve en 100ler ...,akp iktidarında ilk ve en 100ler ...
630,nüfus cüzdanına göre 10 yaşın da olan kapkaççı,nüfus cüzdanına göre 10 yaşında olan kapkaççı
631,çevre ödülün de şaşırtan tercih,çevre ödülünde şaşırtan tercih
632,her 2 saniye de bir ürün satıyor,her 2 saniyede bir ürün satıyor
633,müzeyyen senar bir hafta yatmak zorun da,müzeyyen senar bir hafta yatmak zorunda
634,fenerbahçeye marcelinho da yeni umut,fenerbahçeye marcelinhoda yeni umut