id,src,tgt
383,cesedini battaniyeye sarıp eve getirirken acı için de kıvranıyordu son,cesedini battaniyeye sarıp eve getirirken acı içinde kıvranıyordu son
384,los angeles de başlayan 2006 yılının ilk otomobil fuarın da lüks araçlar görücüye çıktı .,los angeleste başlayan 2006 yılının ilk otomobil fuarında lüks araçlar görücüye çıktı .
385,"tem otoyolun da zincirleme trafik kazası meydana geldi , 16 araç birbirine girdi .","tem otoyolunda zincirleme trafik kazası meydana geldi , 16 araç birbirine girdi ."
386,kaza da 12 ölü 45 yaralı var .,kazada 12 ölü 45 yaralı var .
387,yunanistanda ki kamp da pkkcılarla dhkclilerda taştı .,yunanistandaki kampta pkkcılarla dhkcliler da taştı .
388,youla sonun da gitti !,youla sonunda gitti !
389,gülmek isteyenler için hepsi mizah da ...,gülmek isteyenler için hepsi mizahta ...
390,bütün partiler oyun için de oyun oynadı .,bütün partiler oyun içinde oyun oynadı .
391,birde bize sürekli pazarlıkçı diyorlar .,bir de bize sürekli pazarlıkçı diyorlar .
392,pazarlık yapan varsa oda hükümettir .,pazarlık yapan varsa o da hükümettir .
393,ama iktidar partileri oyun için de oyun yaptı .,ama iktidar partileri oyun içinde oyun yaptı .
394,"onun içinde diyoruz ki , bu , demokratik bir anlayış değil .","onun için de diyoruz ki , bu , demokratik bir anlayış değil ."
395,"sayın bahçeli , gün gelir bizim yapmak da olduğumuz bu mücadeleye sizinde ihtiyacınız olabilir .","sayın bahçeli , gün gelir bizim yapmakta olduğumuz bu mücadeleye sizin de ihtiyacınız olabilir ."
396,bende size bir haber vereyim .,ben de size bir haber vereyim .
397,58’inci hükümet de tam 14 bakanın eşi türban takıyor .,58’inci hükümette tam 14 bakanın eşi türban takıyor .
398,birde dayak yedi !,bir de dayak yedi !
399,öğretmene sınıf da dayak !,öğretmene sınıfta dayak !
400,güney koreden gelen çatışma görüntülerinide kaçırmayın ...,güney koreden gelen çatışma görüntülerini de kaçırmayın ...
401,ab de gelişmenin coşkusu yaşanıyor .,abde gelişmenin coşkusu yaşanıyor .
402,ancak akılları kurcalayan sorunlarda var .,ancak akılları kurcalayan sorunlar da var .
403,afyon da çıplak protesto son haber,afyonda çıplak protesto son haber
404,tatildeyken laptobunu çaldıran cem özerin bilgisayarında ki ünlülere ait telefon numara yarı i̇nternetten geziyor,tatildeyken laptobunu çaldıran cem özerin bilgisayarındaki ünlülere ait telefon numara yarı i̇nternetten geziyor
405,türleri arjantin televizyonların da yayınlandı .,türleri arjantin televizyonlarında yayınlandı .
406,1 mayıs dünya dada coşkuyla kutlandı .,1 mayıs dünyada da coşkuyla kutlandı .
407,suyla hem halkı hemde doktorları mutlu edecek .,suyla hem halkı hem de doktorları mutlu edecek .
408,"i̇stanbul büyükşehir belediyesi , avrupanın en büyük deniz akvaryumu loceanograficin benzerini florya da kuruyor ...","i̇stanbul büyükşehir belediyesi , avrupanın en büyük deniz akvaryumu loceanograficin benzerini floryada kuruyor ..."
409,"anket de altın , gümüş ve bronz olarak üç farklı kadro seçildi .","ankette altın , gümüş ve bronz olarak üç farklı kadro seçildi ."
410,"stamford kenti , beverly hillsi geri de bıraktı ...","stamford kenti , beverly hillsi geride bıraktı ..."
411,kul lada mı yo ruz !,kul la da mı yo ruz !
412,"şampiyon atletimiz süreyya ayhan , milletler kupası yarışların da rahat bir yarış çıkararak 4.06 .","şampiyon atletimiz süreyya ayhan , milletler kupası yarışlarında rahat bir yarış çıkararak 4.06 ."
413,ilik dereceyle 1.500 metre de birinci oldu ...,ilik dereceyle 1.500 metrede birinci oldu ...
414,yarışmacı şimdi hastane de ...,yarışmacı şimdi hastanede ...
415,yunanistan da bir milyarder doğup büyüdüğü kasabaya büyük bir servet bıraktı .,yunanistanda bir milyarder doğup büyüdüğü kasabaya büyük bir servet bıraktı .
416,"mesut yılmazın eşi berna yılmaz , kemal dervişin kabine de kadın bakan isteğine destek çıktı ...","mesut yılmazın eşi berna yılmaz , kemal dervişin kabinede kadın bakan isteğine destek çıktı ..."
417,ama küçük bir şaka yapmak isterken kendisini cezaevin de buldu .,ama küçük bir şaka yapmak isterken kendisini cezaevinde buldu .
418,akbankda evlenebilir !,akbank da evlenebilir !
419,bir zamanlar ithal otomobil için galeriler de kuyruğa girenler artık kalmadı .,bir zamanlar ithal otomobil için galerilerde kuyruğa girenler artık kalmadı .
420,"biri bizi gözetleiyorum açık farkla ön de götüren edi , diskalifiye olmaktan son anda kurtuldu .","biri bizi gözetleiyorum açık farkla önde götüren edi , diskalifiye olmaktan son anda kurtuldu ."
421,taksiye çıktığın da oyun kurallarını ihlal eden edi gözyaşlarını tutamadı ...,taksiye çıktığında oyun kurallarını ihlal eden edi gözyaşlarını tutamadı ...
422,başı fena dert de !,başı fena dertte !
423,ünlü sanatçı mustafa sandalın başı vergi borcu nedeniyle dert de .,ünlü sanatçı mustafa sandalın başı vergi borcu nedeniyle dertte .
424,"üç yıl hapis istemiyle yargılandığı mahkeme , bir sonra ki duruşmaya zorla getirilmesini istedi","üç yıl hapis istemiyle yargılandığı mahkeme , bir sonraki duruşmaya zorla getirilmesini istedi"
425,"virginia üniversitesin de yapılan araştırmalar da , cep telefonunun öğrenciler de zihni yorarak öğrenmeyi engellediği ortaya çıktı .","virginia üniversitesinde yapılan araştırmalarda , cep telefonunun öğrencilerde zihni yorarak öğrenmeyi engellediği ortaya çıktı ."
426,barajlar da geçen yıla göre % 61lik fazlalık var,barajlarda geçen yıla göre % 61lik fazlalık var
427,anket de % 75lik destek alan ceme göre bu çok önemli bir gösterge ...,ankette % 75lik destek alan ceme göre bu çok önemli bir gösterge ...
428,"yapılan deniz suyu ölçümlerin de , 2001 yılına göre kirlilik oranın da düşüş saptandı .","yapılan deniz suyu ölçümlerinde , 2001 yılına göre kirlilik oranında düşüş saptandı ."
429,bazı bölgeler de koli basiline rastlanmadı,bazı bölgelerde koli basiline rastlanmadı
430,ünlü futbolcuyu dört gözle bekleyenler sadece avrupa’nın ön de gelen kulüpleri değil .,ünlü futbolcuyu dört gözle bekleyenler sadece avrupa’nın önde gelen kulüpleri değil .
431,dışarın da çok sıcak bir hava var ve siz dışarı çıkmak istemiyorsunuz .,dışarında çok sıcak bir hava var ve siz dışarı çıkmak istemiyorsunuz .
432,"yaptığı göbek şovla ünlenen ne , iddialı bir çalışma için de .","yaptığı göbek şovla ünlenen ne , iddialı bir çalışma içinde ."
433,14 yaşın da trafik canavarı,14 yaşında trafik canavarı
434,yeni yıl da vergi ve harçlar,yeni yılda vergi ve harçlar
435,emlak ve çöp vergisinde ki artış % 5.6 olacak ...,emlak ve çöp vergisindeki artış % 5.6 olacak ...
436,la birlik de havalar ısını,la birlikte havalar ısını
437,"nihat özdemir , diyarbakırda","nihat özdemir , diyarbakır da"
438,çın da tribünleri boş bırakan taraftara sitem etti,çında tribünleri boş bırakan taraftara sitem etti
439,samsunspor deplasmanın da 4 gol bulan beşiktaş 3 puanı alan taraf oldu ...,samsunspor deplasmanında 4 gol bulan beşiktaş 3 puanı alan taraf oldu ...
440,çeteyle bağlantılı bir belediye başkanının makam odasın da çok sayı da dinamit bulundu .,çeteyle bağlantılı bir belediye başkanının makam odasında çok sayıda dinamit bulundu .
441,"çete , en düstri holding mallarının yağmalan maçın da rol oynamış son haber","çete , en düstri holding mallarının yağmalan maçında rol oynamış son haber"
442,enflasyon hedefin altın da !,enflasyon hedefin altında !
443,adalet baskanlığın da korkutan patlama son,adalet baskanlığında korkutan patlama son
444,memura bayram da çifte müjde !,memura bayramda çifte müjde !
445,ardından boşluğa doğru süzüldü ve yan apart mana yaslanarak hava da böyle durabildi son haber,ardından boşluğa doğru süzüldü ve yan apart mana yaslanarak havada böyle durabildi son haber
446,windowsuda ki açık yüzünden yüzmilyonlarca bilgisayar virüs tehdidi altın da ...,windowsudaki açık yüzünden yüzmilyonlarca bilgisayar virüs tehdidi altında ...
447,"i̇ngiltere , ülkenin en yoğun göçmenlik bürosun da yaşanan seks skandalıyla çalkalanıyor !","i̇ngiltere , ülkenin en yoğun göçmenlik bürosunda yaşanan seks skandalıyla çalkalanıyor !"
448,buda taş devri diyeti,bu da taş devri diyeti
449,almanya da spor salonunun çatısı çöktü,almanyada spor salonunun çatısı çöktü
450,atina da bombalı sabah ...,atinada bombalı sabah ...
451,doğalgaz da tek bir ülkeye bağlı değiliz,doğalgazda tek bir ülkeye bağlı değiliz
452,i̇ki kupayıda istiyoruz ...,i̇ki kupayı da istiyoruz ...
453,fransada yumuşadı !,fransa da yumuşadı !
454,türkiyenin ab üyeliğine karşı çıkan fransanın görüşlerinde ki değişimi bugün chirac şöyle dile getirdi son haber,türkiyenin ab üyeliğine karşı çıkan fransanın görüşlerindeki değişimi bugün chirac şöyle dile getirdi son haber
455,hafta sonun da yurdun tümü bahar havası yaşayacak .,hafta sonunda yurdun tümü bahar havası yaşayacak .
456,türkiye de tezkere tartışmaları yaşanırken abd de kapalı kapılar ardın da neler konuşuluyordu .,türkiyede tezkere tartışmaları yaşanırken abdde kapalı kapılar ardında neler konuşuluyordu .
457,belçika da bugün yayınlanan gazeteler de milli takım ve ersun yanala şu övgüler yeraldı son haber,belçikada bugün yayınlanan gazetelerde milli takım ve ersun yanala şu övgüler yeraldı son haber
458,hileleri gıda üretene ağır ceza yol da !,hileleri gıda üretene ağır ceza yolda !
459,"abd , kktcyede factor diplomatik tanınma sunabilir !","abd , kktcye de factor diplomatik tanınma sunabilir !"
460,mars da işlem tamam !,marsta işlem tamam !
461,istanbullular tv de ne izliyor ?,istanbullular tvde ne izliyor ?
462,daumun gözü sambacılar da !,daumun gözü sambacılarda !
463,kapalı kapılar ardın da !,kapalı kapılar ardında !
464,herkesin heyecanla beklediği dsp grup toplantısının basına kapalı bölümün de neler konuşuldu .,herkesin heyecanla beklediği dsp grup toplantısının basına kapalı bölümünde neler konuşuldu .
465,newsweekin yorumuna göre böyle bir koalisyon batı ve imf içinde iyi bir seçenek .,newsweekin yorumuna göre böyle bir koalisyon batı ve imf için de iyi bir seçenek .
466,az ileri de bir başka bankayı soymaya çalışınca bu kez yakalandı ...,az ileride bir başka bankayı soymaya çalışınca bu kez yakalandı ...
467,i̇talyaya transferi olay olan hakan şükürü şimdide parma elinden çıkartmak istiyor .,i̇talyaya transferi olay olan hakan şükürü şimdi de parma elinden çıkartmak istiyor .
468,son istifalardan sonra değişen aritmetiğe uygun olarak meclis de oturma düzenide değişti ...,son istifalardan sonra değişen aritmetiğe uygun olarak mecliste oturma düzeni de değişti ...
469,sivas da doğan ve kardeşlerini karnın da taşıyan bebeğe bugün başarılı bir ameliyat yapıldı .,sivasta doğan ve kardeşlerini karnında taşıyan bebeğe bugün başarılı bir ameliyat yapıldı .
470,ortegada zamanla anlar,ortega da zamanla anlar
471,i̇dam cezalarıda bu gelişmenin önüne geçmiyor .,i̇dam cezaları da bu gelişmenin önüne geçmiyor .
472,musti turne de tuba barlar da,musti turnede tuba barlarda
473,"mustafa sandal’la aşk yaşayan tuba ünsal , önce ki gece ortaköy’de ki buz bar’daydı .","mustafa sandal’la aşk yaşayan tuba ünsal , önceki gece ortaköy’deki buz bar’daydı ."
474,ancak o abisinin ehliyetini alıp gizlice şehirlerarası otobüsler de çalışmaya devam etti .,ancak o abisinin ehliyetini alıp gizlice şehirlerarası otobüslerde çalışmaya devam etti .
475,i̇zmir konak da avukat mehmet oğuz duş almak için banyoya girdi .,i̇zmir konakta avukat mehmet oğuz duş almak için banyoya girdi .
476,patlama öyle şiddetli idi ki sokakta ki 15 araç hasar gördü,patlama öyle şiddetli idi ki sokaktaki 15 araç hasar gördü
477,hırvatistan maçın da herkesi çileden çıkaran i̇ngiliz hakem stokes sırbistan maçına atandı .,hırvatistan maçında herkesi çileden çıkaran i̇ngiliz hakem stokes sırbistan maçına atandı .
478,ümit milli takım ve schalke de fırtına gibi esen hamite alanlar kancayı fena taktı .,ümit milli takım ve schalkede fırtına gibi esen hamite alanlar kancayı fena taktı .
479,kamp da neler oldu ?,kampta neler oldu ?
480,şehrin ortasın da kurşun !,şehrin ortasında kurşun !
481,"bakırköy de semih i̇mrahor adlı işadamı , evinin önün de uğradığı silahlı saldırı sonucu ağır yaralandı .","bakırköyde semih i̇mrahor adlı işadamı , evinin önünde uğradığı silahlı saldırı sonucu ağır yaralandı ."
482,milli basketçiler kaya peker ile kerem tunçeri gittikleri sandviç büfesin de müşteriler arasında ki kavgaya karıştı .,milli basketçiler kaya peker ile kerem tunçeri gittikleri sandviç büfesinde müşteriler arasındaki kavgaya karıştı .
483,"belçika , abd ile arasın da gerginliğe yol açan , savaş suçları yasasını değiştiriyor .","belçika , abd ile arasında gerginliğe yol açan , savaş suçları yasasını değiştiriyor ."
484,hepburn yıllarca birlik de yaşadığı spencer tracyken dayak yedi ve evliliği hiç düşünmedi ...,hepburn yıllarca birlikte yaşadığı spencer tracyken dayak yedi ve evliliği hiç düşünmedi ...
485,malatyanın pütürge i̇lçelinde saat 04.48de 5.7 büyüklüğün de bir deprem oldu .,malatyanın pütürge i̇lçelinde saat 04.48de 5.7 büyüklüğünde bir deprem oldu .
486,çevre illerdende hissedilen deprem de can ve mal kaybı yok !,çevre illerden de hissedilen depremde can ve mal kaybı yok !
487,"tarih de hiçbir süper güç , yeryüzün de abd gibi egemenlik kurmadı .","tarihte hiçbir süper güç , yeryüzünde abd gibi egemenlik kurmadı ."
488,galatasaray yeni transferleriyle kombine bilet satışın da patlama yaşadı .,galatasaray yeni transferleriyle kombine bilet satışında patlama yaşadı .
489,80 bin kişilik olimpiyat stadı için 6 gün de toplam 20 bin 500 kombine bilet satıldı,80 bin kişilik olimpiyat stadı için 6 günde toplam 20 bin 500 kombine bilet satıldı
490,son 14 maçın 13’ünü kaybeden göztepe karşısın da bile tutunamadı,son 14 maçın 13’ünü kaybeden göztepe karşısında bile tutunamadı
491,"lig de kalması mucizelere bağlı göztepe , bir ara 3 ılık üstünlüğü yakaladı .","ligde kalması mucizelere bağlı göztepe , bir ara 3 ılık üstünlüğü yakaladı ."
492,moldovya’nın son anda ki golleriyle hezimet yaşanmadı,moldovya’nın son andaki golleriyle hezimet yaşanmadı
493,"bahçe , son 14 maçın 13’ünü kaybeden göztepe karşısın da bile tutunamadı .","bahçe , son 14 maçın 13’ünü kaybeden göztepe karşısında bile tutunamadı ."
494,"bahçe , taraftarlarından tepki aldı , gaziantepspor’dan sonra samsunspor’unda gerisin de kaldı .","bahçe , taraftarlarından tepki aldı , gaziantepspor’dan sonra samsunspor’un da gerisinde kaldı ."
495,"kaleci oğuz 35. dakika da acemice kart gördü , takım 10 kişi kaldı .","kaleci oğuz 35. dakikada acemice kart gördü , takım 10 kişi kaldı ."
496,i̇kinci yarı da göztepe’nin ani atakların da savunma sürekli az adamla yakalandı .,i̇kinci yarıda göztepe’nin ani ataklarında savunma sürekli az adamla yakalandı .
497,"remzi , bülent ve burak’ın nefis golleriyle skor bir anda 3da taşındı .","remzi , bülent ve burak’ın nefis golleriyle skor bir anda 3 da taşındı ."
498,son dakikalar da moldovya’nın iki golü f .,son dakikalarda moldovya’nın iki golü f .
499,yöneticileri her zaman arkaların da .,yöneticileri her zaman arkalarında .
500,artık bizim hedefimiz önümüzde ki sezon türk futboluna yakışır f .,artık bizim hedefimiz önümüzdeki sezon türk futboluna yakışır f .
501,bu ara da menajer selim soydan’ın göz yaşlarına engel olamadığı görüldü .,bu arada menajer selim soydan’ın göz yaşlarına engel olamadığı görüldü .
502,taraftarlar bir arada göztepeyi futbolcuları alkışladılar .,taraftarlar bir ara da göztepeyi futbolcuları alkışladılar .
503,"protesto , karşılaşma sonrasıda devam etti .","protesto , karşılaşma sonrası da devam etti ."
504,bahçe karşısın da tarihin de ikinci galibiyetini aldı .,bahçe karşısında tarihinde ikinci galibiyetini aldı .
505,"f. bahçe teknik direktörü turhan sofuoğlu , kaleyi engin’inde onayıyla genç oğuz’a verdi .","f.bahçe teknik direktörü turhan sofuoğlu , kaleyi engin’in de onayıyla genç oğuz’a verdi ."
506,sahayı büyük bir üzüntü için de terk eden oğuz’un gözlerininde dolu dolu olduğu görüldü .,sahayı büyük bir üzüntü içinde terk eden oğuz’un gözlerinin de dolu dolu olduğu görüldü .
507,çekilişin ilk bölümü kızılay da genel müdürlük binasın da yapıldı,çekilişin ilk bölümü kızılayda genel müdürlük binasında yapıldı
508,henüz 7 yaşın da ...,henüz 7 yaşında ...
509,babası tabancasını oda da bıraktı .,babası tabancasını odada bıraktı .
510,milli takımın devre arasın da dubai de yapacağı hazırlık kampının aday futbolcuları açıklanmıştı .,milli takımın devre arasında dubaide yapacağı hazırlık kampının aday futbolcuları açıklanmıştı .
511,ancak baş da fatih terim karşı çıkanlar vardı .,ancak başta fatih terim karşı çıkanlar vardı .
512,"sydney de onbinlerce kişi , yeni yılı muhteşem bir havai fişek gösterisi ile karşıladı","sydneyde onbinlerce kişi , yeni yılı muhteşem bir havai fişek gösterisi ile karşıladı"
513,"dünya , türkiyenin irak operasyonun da nasıl davranacağını merakla bekliyor .","dünya , türkiyenin irak operasyonunda nasıl davranacağını merakla bekliyor ."
514,"uzmanlara göre aşırı alkol tüketiminin sabahın da baş ağrısıyla uyanmak , bir zehirlenme belirtisi .","uzmanlara göre aşırı alkol tüketiminin sabahında baş ağrısıyla uyanmak , bir zehirlenme belirtisi ."
515,yılbaşının ardından dinç uyanmanın sırrı detoks mönüsün de .,yılbaşının ardından dinç uyanmanın sırrı detoks mönüsünde .
516,"her ülke de , yeni yılın uğurlu gelmesi için çeşitli inançlar var .","her ülkede , yeni yılın uğurlu gelmesi için çeşitli inançlar var ."
517,"kimin de börülce yeniyor , kimi masasına 12 çeşit meyve koyuyor .","kiminde börülce yeniyor , kimi masasına 12 çeşit meyve koyuyor ."
518,i̇şte dünya da yeni yıl inançları,i̇şte dünyada yeni yıl inançları
519,ancak yağmur ve rüzgarı görünce hamamla yetinmek zorun da kaldı .,ancak yağmur ve rüzgarı görünce hamamla yetinmek zorunda kaldı .
520,"bir yılı daha geri de bırakıp , 2003e merhaba demeye saatler kaldı .","bir yılı daha geride bırakıp , 2003e merhaba demeye saatler kaldı ."
521,"şimdi eğlenme zamanı , bir yılın yorgunluğunu atıp yeni yılı mutluluk için de karşılama zamanı .","şimdi eğlenme zamanı , bir yılın yorgunluğunu atıp yeni yılı mutluluk içinde karşılama zamanı ."
522,öyleyse hep birlik de gülümseyelim ...,öyleyse hep birlikte gülümseyelim ...
523,sizce türkiye olası irak operasyonun da yer almalı mı ?,sizce türkiye olası irak operasyonunda yer almalı mı ?
524,trtde ki program için suç duyurusu son,trtdeki program için suç duyurusu son
525,çılgın pozlarıyla tanınan paris hiltonun annesininde gençliğin de seksi fotoğraflar çektirdiği ortaya çıktı yeni haber,çılgın pozlarıyla tanınan paris hiltonun annesinin de gençliğinde seksi fotoğraflar çektirdiği ortaya çıktı yeni haber
526,pkk cenaze de şov yaptı,pkk cenazede şov yaptı
527,faiz yüz de 1in altına iner,faiz yüzde 1in altına iner
528,konut kredisinde bankalar arasın da kıya sıya mücadele sürüyor .,konut kredisin de bankalar arasında kıya sıya mücadele sürüyor .
529,2006 da oranların yüz de 1in altına düşmesi bekleniyor son,2006da oranların yüzde 1in altına düşmesi bekleniyor son
530,ayvalık da 15 yaşında ki kız hamile kalınca korkunç gerçek ortaya çıktı .,ayvalıkta 15 yaşındaki kız hamile kalınca korkunç gerçek ortaya çıktı .
531,i̇ngiliz ve alman gazeteleri dün akşam ki maçla ilgili terbiyesiz başlıklar attı,i̇ngiliz ve alman gazeteleri dün akşamki maçla ilgili terbiyesiz başlıklar attı
532,masa başın da toplu hücuma geçtiler .,masa başında toplu hücuma geçtiler .
533,lonfat maçtan sonra tünel de polisin kendilerini dövdüğünü öne sürdü son haber,lonfat maçtan sonra tünelde polisin kendilerini dövdüğünü öne sürdü son haber
534,kulüplerede kötü haber !,kulüplere de kötü haber !
535,futbol da başa rasız sonuçlar dan sonra ülke sıralamasın da 11 puan geri dedik .,futbolda başa rasız sonuçlar dan sonra ülke sıralamasında 11 puan geri dedik .
536,artık şampiyonlar ligin de ön eleme var ...,artık şampiyonlar liginde ön eleme var ...
537,hollândam da ilginç başörtüsü davası,hollândamda ilginç başörtüsü davası
538,fransa da şiddet bitmiyor !,fransada şiddet bitmiyor !
539,"13 yaşında ki kız , düğünden sonra evden kaçtı !","13 yaşındaki kız , düğünden sonra evden kaçtı !"
540,van da demiryoluna pkk bombası !,vanda demiryoluna pkk bombası !
541,amasya da kanlı soygun !,amasyada kanlı soygun !
542,trafik kazasın da 5 kişilik aile yok oldu !,trafik kazasında 5 kişilik aile yok oldu !
543,"i̇ki hakemde türkiyeye kıymıştır , yazık etmiştir","i̇ki hakem de türkiyeye kıymıştır , yazık etmiştir"
544,arınçın annesi seviye hanımın başın da türban yok ...,arınçın annesi seviye hanımın başında türban yok ...
545,çılgın kızlar sinema da !,çılgın kızlar sinemada !
546,birbirinden güzel filmler vizyon da ...,birbirinden güzel filmler vizyonda ...
547,"başbakan abdullah gül , hükümet programını tam 1 saat 18 dakika da okudu .","başbakan abdullah gül , hükümet programını tam 1 saat 18 dakikada okudu ."
548,"nijerya da yapılacak güzellik yarışması , yüzü aşkın kişinin ölümüne neden olaylar yüzünden iptal edildi .","nijeryada yapılacak güzellik yarışması , yüzü aşkın kişinin ölümüne neden olaylar yüzünden iptal edildi ."
549,yarışmanın londra da yapılması kararlaştırıldı,yarışmanın londrada yapılması kararlaştırıldı
550,"fenerbahçe , kocaelispor karşısın da , washington ve orteganın ayağından iki gol buldu .","fenerbahçe , kocaelispor karşısında , washington ve orteganın ayağından iki gol buldu ."
551,bahar havası geri de kaldı .,bahar havası geride kaldı .
552,üstelik dijital kalite de ...,üstelik dijital kalitede ...
553,kelsimin başı dert de !,kelsimin başı dertte !
554,toplam 20 bin erkek üzerin de yapılan araştırmalar da evliliğin erkeğin ömrünü uzattığı anlaşıldı,toplam 20 bin erkek üzerinde yapılan araştırmalarda evliliğin erkeğin ömrünü uzattığı anlaşıldı
555,i̇kinci el piyasasın da son durum ...,i̇kinci el piyasasında son durum ...
556,beyanname üzerinden hesaplanan vergi üç eşit taksit de ödenecek .,beyanname üzerinden hesaplanan vergi üç eşit taksitte ödenecek .
557,kamyonetin direksiyonun da 11 yaşın da bir çocuk .,kamyonetin direksiyonunda 11 yaşında bir çocuk .
558,türkiye de illere göre kişi başına düşen gayri safi hasıla bugün açıklandı .,türkiyede illere göre kişi başına düşen gayri safi hasıla bugün açıklandı .
559,şubat ayın da yapılacak nema ödemesi bu kez yüzleri güldürecek .,şubat ayında yapılacak nema ödemesi bu kez yüzleri güldürecek .
560,bu sene ki ödeme geçtiğimiz yılı dörde katlayacak .,bu seneki ödeme geçtiğimiz yılı dörde katlayacak .
561,ora da neler olmadı !,orada neler olmadı !
562,bbgciler ilgazıda karıştırdı .,bbgciler ilgazı da karıştırdı .
563,ora da neler oluyor ?,orada neler oluyor ?
564,bütün okulun izlediği duruşma da 8 yıl hapise çarptırıldı,bütün okulun izlediği duruşmada 8 yıl hapise çarptırıldı
565,"bolu da eczane , ispartada hastane yatağı bol ...","boluda eczane , ispartada hastane yatağı bol ..."
566,hamile kadının karnında ki bebeği tekmeler sonucu öldü,hamile kadının karnındaki bebeği tekmeler sonucu öldü
567,"dadı dizisiyle oyunculuğa adım atan sinem kobal , oyunculuk da kendini fazla yetenekli bulmadığını söyledi ...","dadı dizisiyle oyunculuğa adım atan sinem kobal , oyunculukta kendini fazla yetenekli bulmadığını söyledi ..."
568,hava sıcaklıkların da ise ani düşüş var ...,hava sıcaklıklarında ise ani düşüş var ...
569,konyasporu ağırlayan denizlispor rakibini 3 2 yenerek puan sıralamasın da 3. sıraya yerleşti .,konyasporu ağırlayan denizlispor rakibini 3 2 yenerek puan sıralamasında 3. sıraya yerleşti .
570,süper lig de ve avrupa da günün diğer sonuçları şöyle ...,süper ligde ve avrupada günün diğer sonuçları şöyle ...
571,200 dil de milyonlarca sözcüğün anlamını öğrenmek çok kolay !,200 dilde milyonlarca sözcüğün anlamını öğrenmek çok kolay !
572,güneydoğu asya dışın da kuş gribinden ilk ölüm vakaları türkiye de görüldü .,güneydoğu asya dışında kuş gribinden ilk ölüm vakaları türkiyede görüldü .
